{
  "schemaVersion": 1,
  "chipId": "stm32f103c8t6",
  "package": "LQFP48",
  "source": "STM32F103C8T6引脚定义.xlsx（DS5319 Table 5 转录）",
  "verified": true,
  "verifiedNote": "引脚号、引脚名、复用功能与 5V 容忍（FT）标记均来自《STM32F103C8T6引脚定义.xlsx》（DS5319 Table 5 转录），已由用户确认该表完全正确（2026-10-15）。重新解析该表与本文件逐字段比对无差异。",
  "pins": [
    {
      "number": 1,
      "name": "VBAT",
      "groups": [
        "power"
      ],
      "defaultFunction": "VBAT",
      "defaultFunctionZh": "备份域供电。接纽扣电池可让 RTC 与备份寄存器在主电源掉电后继续工作。",
      "functions": [
        {
          "name": "VBAT",
          "kind": "power",
          "remapRequired": false,
          "peripheralId": "",
          "remapNoteZh": ""
        }
      ],
      "fiveVoltTolerant": false,
      "jtagSwd": null,
      "notesZh": "不用电池时直接接 VDD（3.3V），不要悬空。",
      "relatedFunctionIds": []
    },
    {
      "number": 2,
      "name": "PC13",
      "groups": [
        "gpio"
      ],
      "defaultFunction": "PC13",
      "defaultFunctionZh": "PC13，通用 IO。可复用为侵入检测（TAMPER-RTC）与 RTC 校准输出。",
      "functions": [
        {
          "name": "PC13",
          "kind": "gpio",
          "remapRequired": false,
          "peripheralId": "GPIO",
          "remapNoteZh": ""
        },
        {
          "name": "TAMPER-RTC",
          "kind": "other",
          "remapRequired": false,
          "peripheralId": "BKP",
          "remapNoteZh": ""
        }
      ],
      "fiveVoltTolerant": false,
      "jtagSwd": null,
      "notesZh": "蓝板板载 LED 接在 PC13，低电平点亮。该脚属于备份域，驱动能力弱（最大 3mA），不要直接驱动大电流负载。",
      "relatedFunctionIds": []
    },
    {
      "number": 3,
      "name": "PC14",
      "groups": [
        "gpio"
      ],
      "defaultFunction": "PC14",
      "defaultFunctionZh": "PC14，通用 IO。默认复用为 32.768kHz 低速晶振输入（OSC32_IN）。",
      "functions": [
        {
          "name": "PC14",
          "kind": "gpio",
          "remapRequired": false,
          "peripheralId": "GPIO",
          "remapNoteZh": ""
        },
        {
          "name": "OSC32_IN",
          "kind": "other",
          "remapRequired": false,
          "peripheralId": "RCC",
          "remapNoteZh": ""
        }
      ],
      "fiveVoltTolerant": false,
      "jtagSwd": null,
      "notesZh": "接外部 32.768kHz 晶振时不能再当普通 IO 用。不接晶振时可作普通 IO，但需注意备份域驱动能力弱。",
      "relatedFunctionIds": []
    },
    {
      "number": 4,
      "name": "PC15",
      "groups": [
        "gpio"
      ],
      "defaultFunction": "PC15",
      "defaultFunctionZh": "PC15，通用 IO。默认复用为 32.768kHz 低速晶振输出（OSC32_OUT）。",
      "functions": [
        {
          "name": "PC15",
          "kind": "gpio",
          "remapRequired": false,
          "peripheralId": "GPIO",
          "remapNoteZh": ""
        },
        {
          "name": "OSC32_OUT",
          "kind": "other",
          "remapRequired": false,
          "peripheralId": "RCC",
          "remapNoteZh": ""
        }
      ],
      "fiveVoltTolerant": false,
      "jtagSwd": null,
      "notesZh": "同 PC14。",
      "relatedFunctionIds": []
    },
    {
      "number": 5,
      "name": "OSC_IN",
      "groups": [
        "osc"
      ],
      "defaultFunction": "OSC_IN",
      "defaultFunctionZh": "外部高速晶振输入（OSC_IN），通常接 8MHz 晶振。",
      "functions": [
        {
          "name": "OSC_IN",
          "kind": "osc",
          "remapRequired": false,
          "peripheralId": "",
          "remapNoteZh": ""
        }
      ],
      "fiveVoltTolerant": false,
      "jtagSwd": null,
      "notesZh": "使用 HSE 时必接。若用内部 HSI 或外部有源晶振，该脚可作普通 IO（PD0）。",
      "relatedFunctionIds": []
    },
    {
      "number": 6,
      "name": "OSC_OUT",
      "groups": [
        "osc"
      ],
      "defaultFunction": "OSC_OUT",
      "defaultFunctionZh": "外部高速晶振输出（OSC_OUT），通常接 8MHz 晶振另一端。",
      "functions": [
        {
          "name": "OSC_OUT",
          "kind": "osc",
          "remapRequired": false,
          "peripheralId": "",
          "remapNoteZh": ""
        }
      ],
      "fiveVoltTolerant": false,
      "jtagSwd": null,
      "notesZh": "使用 HSE 时必接。",
      "relatedFunctionIds": []
    },
    {
      "number": 7,
      "name": "NRST",
      "groups": [
        "reset"
      ],
      "defaultFunction": "NRST",
      "defaultFunctionZh": "复位引脚，低电平复位。",
      "functions": [
        {
          "name": "NRST",
          "kind": "reset",
          "remapRequired": false,
          "peripheralId": "",
          "remapNoteZh": ""
        }
      ],
      "fiveVoltTolerant": false,
      "jtagSwd": null,
      "notesZh": "内部已有上拉，通常只需接一个 100nF 电容到地。手动复位按键接这里。",
      "relatedFunctionIds": []
    },
    {
      "number": 8,
      "name": "VSSA",
      "groups": [
        "ground"
      ],
      "defaultFunction": "VSSA",
      "defaultFunctionZh": "模拟部分地（VSSA），接模拟地。",
      "functions": [
        {
          "name": "VSSA",
          "kind": "ground",
          "remapRequired": false,
          "peripheralId": "",
          "remapNoteZh": ""
        }
      ],
      "fiveVoltTolerant": false,
      "jtagSwd": null,
      "notesZh": "用 ADC 时建议与数字地单点连接，减少干扰。",
      "relatedFunctionIds": []
    },
    {
      "number": 9,
      "name": "VDDA",
      "groups": [
        "power"
      ],
      "defaultFunction": "VDDA",
      "defaultFunctionZh": "模拟部分电源（VDDA），接 3.3V。",
      "functions": [
        {
          "name": "VDDA",
          "kind": "power",
          "remapRequired": false,
          "peripheralId": "",
          "remapNoteZh": ""
        }
      ],
      "fiveVoltTolerant": false,
      "jtagSwd": null,
      "notesZh": "用 ADC 时必须接，并加 100nF + 1uF 去耦电容。ADC 的参考电压就是 VDDA。",
      "relatedFunctionIds": []
    },
    {
      "number": 10,
      "name": "PA0",
      "groups": [
        "gpio"
      ],
      "defaultFunction": "PA0",
      "defaultFunctionZh": "PA0，通用 IO。可复用为唤醒引脚（WKUP）、USART2_CTS、ADC12_IN0、TIM2_CH1_ETR。",
      "functions": [
        {
          "name": "PA0",
          "kind": "gpio",
          "remapRequired": false,
          "peripheralId": "GPIO",
          "remapNoteZh": ""
        },
        {
          "name": "WKUP",
          "kind": "other",
          "remapRequired": false,
          "peripheralId": "PWR",
          "remapNoteZh": ""
        },
        {
          "name": "USART2_CTS",
          "kind": "af",
          "remapRequired": false,
          "peripheralId": "USART",
          "remapNoteZh": ""
        },
        {
          "name": "ADC12_IN0",
          "kind": "af",
          "remapRequired": false,
          "peripheralId": "ADC",
          "remapNoteZh": ""
        },
        {
          "name": "TIM2_CH1_ETR",
          "kind": "af",
          "remapRequired": false,
          "peripheralId": "TIM",
          "remapNoteZh": ""
        }
      ],
      "fiveVoltTolerant": false,
      "jtagSwd": null,
      "notesZh": "WKUP 功能可在待机模式下唤醒芯片。与 PB0 共用 EXTI0 中断线，两者不能同时用作外部中断。",
      "relatedFunctionIds": []
    },
    {
      "number": 11,
      "name": "PA1",
      "groups": [
        "gpio"
      ],
      "defaultFunction": "PA1",
      "defaultFunctionZh": "PA1，通用 IO。可复用为 USART2_RTS、ADC12_IN1、TIM2_CH2。",
      "functions": [
        {
          "name": "PA1",
          "kind": "gpio",
          "remapRequired": false,
          "peripheralId": "GPIO",
          "remapNoteZh": ""
        },
        {
          "name": "USART2_RTS",
          "kind": "af",
          "remapRequired": false,
          "peripheralId": "USART",
          "remapNoteZh": ""
        },
        {
          "name": "ADC12_IN1",
          "kind": "af",
          "remapRequired": false,
          "peripheralId": "ADC",
          "remapNoteZh": ""
        },
        {
          "name": "TIM2_CH2",
          "kind": "af",
          "remapRequired": false,
          "peripheralId": "TIM",
          "remapNoteZh": ""
        }
      ],
      "fiveVoltTolerant": false,
      "jtagSwd": null,
      "notesZh": "",
      "relatedFunctionIds": []
    },
    {
      "number": 12,
      "name": "PA2",
      "groups": [
        "gpio"
      ],
      "defaultFunction": "PA2",
      "defaultFunctionZh": "PA2，通用 IO。可复用为 USART2_TX、ADC12_IN2、TIM2_CH3。",
      "functions": [
        {
          "name": "PA2",
          "kind": "gpio",
          "remapRequired": false,
          "peripheralId": "GPIO",
          "remapNoteZh": ""
        },
        {
          "name": "USART2_TX",
          "kind": "af",
          "remapRequired": false,
          "peripheralId": "USART",
          "remapNoteZh": ""
        },
        {
          "name": "ADC12_IN2",
          "kind": "af",
          "remapRequired": false,
          "peripheralId": "ADC",
          "remapNoteZh": ""
        },
        {
          "name": "TIM2_CH3",
          "kind": "af",
          "remapRequired": false,
          "peripheralId": "TIM",
          "remapNoteZh": ""
        }
      ],
      "fiveVoltTolerant": false,
      "jtagSwd": null,
      "notesZh": "常用作串口 2 的发送脚。复用为 USART2_TX 时 GPIO 模式必须配 GPIO_Mode_AF_PP。",
      "relatedFunctionIds": []
    },
    {
      "number": 13,
      "name": "PA3",
      "groups": [
        "gpio"
      ],
      "defaultFunction": "PA3",
      "defaultFunctionZh": "PA3，通用 IO。可复用为 USART2_RX、ADC12_IN3、TIM2_CH4。",
      "functions": [
        {
          "name": "PA3",
          "kind": "gpio",
          "remapRequired": false,
          "peripheralId": "GPIO",
          "remapNoteZh": ""
        },
        {
          "name": "USART2_RX",
          "kind": "af",
          "remapRequired": false,
          "peripheralId": "USART",
          "remapNoteZh": ""
        },
        {
          "name": "ADC12_IN3",
          "kind": "af",
          "remapRequired": false,
          "peripheralId": "ADC",
          "remapNoteZh": ""
        },
        {
          "name": "TIM2_CH4",
          "kind": "af",
          "remapRequired": false,
          "peripheralId": "TIM",
          "remapNoteZh": ""
        }
      ],
      "fiveVoltTolerant": false,
      "jtagSwd": null,
      "notesZh": "复用为 USART2_RX 时 GPIO 模式配 GPIO_Mode_IN_FLOATING 或上拉输入。",